{
  "$schema": "https://json-schema.org/draft/2020-12/schema",
  "$id": "urn:project-gateway:schema:registry:1.0:registry-namespace-entry",
  "title": "Registry namespace entry",
  "type": "object",
  "required": [
    "namespace",
    "owner_id",
    "security_review",
    "extension_contracts"
  ],
  "properties": {
    "namespace": {
      "$ref": "urn:project-gateway:schema:artifact:1.0:common:identifiers#/$defs/namespace"
    },
    "owner_id": {
      "const": "project-gateway.protocol-registry"
    },
    "security_review": {
      "$ref": "urn:project-gateway:schema:registry:1.0:governance-security-review"
    },
    "extension_contracts": {
      "type": "array",
      "minItems": 1,
      "maxItems": 32,
      "uniqueItems": true,
      "items": {
        "$ref": "urn:project-gateway:schema:registry:1.0:extension-contract-entry"
      }
    }
  },
  "unevaluatedProperties": false
}
